id_berita,judul,kategori,isi_berita
1486,Pemkab Malteng perkuat pangan lokal lewat tradisi Kora Inasua,ekonomi,"Ambon (ANTARA) - Pemerintah Kabupaten Maluku Tengah (Malteng) memperkuat budaya pangan lokal berbasis tradisi melalui penyelenggaraan Festival Kor’a Inasua di Kecamatan Teon Nila Serua (TNS) sebagai upaya menjaga keberlanjutan budaya sekaligus sumber daya laut.  Bupati Maluku Tengah Zulkarnain Awat Amir di Maluku Tengah, Selasa mengatakan, penguatan budaya pangan lokal seperti inasua harus berjalan seiring dengan pelestarian sumber daya alam, khususnya ekosistem laut. “Sebagai pangan tradisional, inasua menjadi bagian dari identitas masyarakat pesisir di Maluku, khususnya TNS. Dalam hal ini, menjaga laut berkorelasi langsung antara kelestarian lingkungan dengan keberlanjutan budaya dan ekonomi masyarakat,” ujarnya.  Festival ini, kata dia, menjadi ruang ekspresi budaya, edukasi konservasi, dan penguatan ekonomi masyarakat pesisir melalui pengembangan pangan tradisional inasua. Baca juga: Kor'a Inasua, pesta prasmanan ala Teon Nila Serua Inasua merupakan produk kuliner tradisional berupa ikan fermentasi khas masyarakat TNS yang telah ditetapkan sebagai Warisan Budaya Takbenda (WBTb) Indonesia sejak 2015. Produk ini dihasilkan melalui metode pengawetan ikan menggunakan garam, yang berkembang sebagai solusi pemenuhan pangan saat musim angin. Selain mencerminkan kearifan lokal dalam pengelolaan hasil laut, inasua juga menegaskan pentingnya menjaga kesehatan ekosistem laut sebagai sumber bahan baku, termasuk ikan laut dalam seperti ikan gindara (Ruvettus pretiosus).  Menurutnya penguatan kapasitas masyarakat, khususnya kelompok perempuan, menjadi fokus utama melalui berbagai pelatihan. Baca juga: YKAN gelar lokakarya untuk masyarakat Teon Nila Serua di Maluku Tengah Kegiatan itu mencakup peningkatan kualitas produksi inasua yang higienis dan aman konsumsi, literasi keuangan, hingga pengembangan produk dan strategi pemasaran. Selain itu, generasi muda juga dilibatkan melalui edukasi lingkungan, lomba konten media sosial, serta permainan berbasis konservasi guna menumbuhkan kesadaran menjaga laut sejak dini.  Camat Teon Nila Serua Ronald Wonmaly menilai festival ini menjadi momentum strategis untuk membangun kesadaran kolektif masyarakat dalam menjaga praktik pemanfaatan sumber daya laut secara bijak. “Kami mendorong masyarakat untuk terus menjaga praktik-praktik lokal yang arif dalam memanfaatkan hasil laut. Festival ini menjadi ruang belajar bersama tentang pentingnya laut yang sehat bagi kehidupan sehari-hari,” katanya. Baca juga: Inasua, sashimi asin ala Teon Nila Serua Yayasan Konservasi Alam Nusantara (YKAN) turut mendukung penyelenggaraan festival melalui program kelautan yang berfokus pada penguatan budaya lokal, edukasi konservasi, serta pengembangan ekonomi masyarakat pesisir.  Direktur Program Kelautan YKAN Muhammad Ilman mengatakan, praktik tradisional seperti inasua mencerminkan nilai efisiensi dan keberlanjutan yang sejalan dengan upaya konservasi. “Penguatan adat dan budaya lokal merupakan fondasi penting dalam mendorong praktik perikanan berkelanjutan. Ketika masyarakat menjaga tradisinya, pada saat yang sama mereka juga menjaga ekosistem laut,” ujarnya. Ia menambahkan, pendekatan berbasis budaya dinilai efektif dalam mendukung perancangan kawasan konservasi perairan di wilayah TNS yang dilakukan pemerintah dengan dukungan YKAN. Festival Kor’a Inasua diharapkan memperkuat sinergi antara pemerintah daerah, masyarakat adat, dan mitra pembangunan dalam menjaga keberlanjutan sumber daya pesisir, sekaligus meningkatkan kesadaran publik bahwa laut yang sehat menjadi prasyarat utama bagi keberlangsungan budaya dan ekonomi masyarakat pesisir."
1695,Pemkab Malteng perkuat pangan lokal lewat tradisi Kora Inasua,ekonomi,"Ambon (ANTARA) - Pemerintah Kabupaten Maluku Tengah (Malteng) memperkuat budaya pangan lokal berbasis tradisi melalui penyelenggaraan Festival Kor’a Inasua di Kecamatan Teon Nila Serua (TNS) sebagai upaya menjaga keberlanjutan budaya sekaligus sumber daya laut.  Bupati Maluku Tengah Zulkarnain Awat Amir di Maluku Tengah, Selasa mengatakan, penguatan budaya pangan lokal seperti inasua harus berjalan seiring dengan pelestarian sumber daya alam, khususnya ekosistem laut. “Sebagai pangan tradisional, inasua menjadi bagian dari identitas masyarakat pesisir di Maluku, khususnya TNS. Dalam hal ini, menjaga laut berkorelasi langsung antara kelestarian lingkungan dengan keberlanjutan budaya dan ekonomi masyarakat,” ujarnya.  Festival ini, kata dia, menjadi ruang ekspresi budaya, edukasi konservasi, dan penguatan ekonomi masyarakat pesisir melalui pengembangan pangan tradisional inasua. Baca juga: Kor'a Inasua, pesta prasmanan ala Teon Nila Serua Inasua merupakan produk kuliner tradisional berupa ikan fermentasi khas masyarakat TNS yang telah ditetapkan sebagai Warisan Budaya Takbenda (WBTb) Indonesia sejak 2015. Produk ini dihasilkan melalui metode pengawetan ikan menggunakan garam, yang berkembang sebagai solusi pemenuhan pangan saat musim angin. Selain mencerminkan kearifan lokal dalam pengelolaan hasil laut, inasua juga menegaskan pentingnya menjaga kesehatan ekosistem laut sebagai sumber bahan baku, termasuk ikan laut dalam seperti ikan gindara (Ruvettus pretiosus).  Menurutnya penguatan kapasitas masyarakat, khususnya kelompok perempuan, menjadi fokus utama melalui berbagai pelatihan. Baca juga: YKAN gelar lokakarya untuk masyarakat Teon Nila Serua di Maluku Tengah Kegiatan itu mencakup peningkatan kualitas produksi inasua yang higienis dan aman konsumsi, literasi keuangan, hingga pengembangan produk dan strategi pemasaran. Selain itu, generasi muda juga dilibatkan melalui edukasi lingkungan, lomba konten media sosial, serta permainan berbasis konservasi guna menumbuhkan kesadaran menjaga laut sejak dini.  Camat Teon Nila Serua Ronald Wonmaly menilai festival ini menjadi momentum strategis untuk membangun kesadaran kolektif masyarakat dalam menjaga praktik pemanfaatan sumber daya laut secara bijak. “Kami mendorong masyarakat untuk terus menjaga praktik-praktik lokal yang arif dalam memanfaatkan hasil laut. Festival ini menjadi ruang belajar bersama tentang pentingnya laut yang sehat bagi kehidupan sehari-hari,” katanya. Baca juga: Inasua, sashimi asin ala Teon Nila Serua Yayasan Konservasi Alam Nusantara (YKAN) turut mendukung penyelenggaraan festival melalui program kelautan yang berfokus pada penguatan budaya lokal, edukasi konservasi, serta pengembangan ekonomi masyarakat pesisir.  Direktur Program Kelautan YKAN Muhammad Ilman mengatakan, praktik tradisional seperti inasua mencerminkan nilai efisiensi dan keberlanjutan yang sejalan dengan upaya konservasi. “Penguatan adat dan budaya lokal merupakan fondasi penting dalam mendorong praktik perikanan berkelanjutan. Ketika masyarakat menjaga tradisinya, pada saat yang sama mereka juga menjaga ekosistem laut,” ujarnya. Ia menambahkan, pendekatan berbasis budaya dinilai efektif dalam mendukung perancangan kawasan konservasi perairan di wilayah TNS yang dilakukan pemerintah dengan dukungan YKAN. Festival Kor’a Inasua diharapkan memperkuat sinergi antara pemerintah daerah, masyarakat adat, dan mitra pembangunan dalam menjaga keberlanjutan sumber daya pesisir, sekaligus meningkatkan kesadaran publik bahwa laut yang sehat menjadi prasyarat utama bagi keberlangsungan budaya dan ekonomi masyarakat pesisir."
1041,"Mengunci Nadi Dunia Selat Hormuz Tertutup, Dapatkah ALKI Menjadi Solusi",ekonomi,"Andreas Halomoan Silalahi Andreas Halomoan Silalahi Activist  Founder Lembaga Kajian Indonesia Digdaya. Share a common interest in Geopolitics and Enviromental Issue. 2 Maret 2026 2030 WIBwaktu baca 5 menit Tulisan dari Andreas Halomoan Silalahi tidak mewakili pandangan dari redaksi kumparan Eskalasi militer Timur Tengah yang melibatkan Amerika Serikat AS, Israel, dan Iran beberapa waktu belakangan ini bukan lagi sekadar bumbu berita internasional. Dunia saat ini menyaksikan skenario paling menakutkan bagi stabilitas ekonomi global, yaitu penutupan Selat Hormuz. Sebagai jalur pelintasan bagi sekitar 21 juta barel minyak per hari yang setara dengan 21 konsumsi minyak dunia, Hormuz adalah jugular vein atau urat nadi pengalir energi global, yang jika terputus efeknya akan menyebabkan serangan jantung pada ekonomi globaltidak terkecuali Indonesia. Penutupan Selat Hormuz oleh Teheran adalah respons atas serangan gabungan brutal ASIsrael, yang telah menewaskan banyak tokohtokoh berpengaruh di Iran, termasuk Pemimpin Besar Republik Islam Iran, Ayatullah Al Khomeini. Harga minyak mentah jenis Brent melonjak melewati angka 100 per barel hanya dalam hitungan hari. Pakar energi UGM, Fahmy Radhi, memperingatkan bahwa jika konflik ini memanjang, angka 120 hingga 150 bukan lagi hal mustahil. Bagi Indonesia, ini adalah kabar buruk ganda. Sebagai negara net importer minyak, setiap kenaikan harga minyak dunia sebesar 1 per barel berpotensi membengkakkan beban subsidi dan kompensasi energi dalam APBN hingga Rp10,3 triliun CELIOS, 2026. Jika harga bertahan di atas 100, pemerintah akan dihadapkan pada pilihan pahit, yaitu menaikkan harga BBM domestik atau membiarkan defisit anggaran melebar melampaui batas aman 3. Dampak penutupan Hormuz juga merambat ke pasar valuta asing efek penutupan Hormuz terhadap pelemahan rupiah tidak terhindarkan karena kebutuhan dolar AS untuk impor energi meningkat drastis di tengah pelarian modal atau flight to quality ke aset aman seperti emas. Ekonom Universitas Andalas, Prof. Syafruddin Karimi, mencatat bahwa tekanan terhadap rupiah akan mempercepat imported inflation, yaitu inflasi yang disebabkan oleh mahalnya barang impor. Peran Hormuz tentu bukan hanya soal minyak. Jalur ini juga rute utama bagi pengiriman pupuk dan bahan baku petrokimia. Penutupan Hormuz tentu akan menghambat pasokan pupuk berbasis nitrogen dari Timur Tengah ke Asia. Indonesiayang tengah berjuang meningkatkan produktivitas pangandisinyalir akan mengalami kelangkaan pupuk yang tentunya akan berefek sebagai ancaman ketahanan pangan nasional. Ketua Umum Apindo, Shinta Kamdani, juga menekankan bahwa ekspor Indonesia ke kawasan Timur Tengah dan Eropa juga terancam mandek karena kapalkapal komersial dilarang mendekat ke area konflik. Hal ini menyebabkan gangguan rantai pasok terhadap sektor industri yang berorientasi ekspor dan dapat berefek terhadap pengurangan tenaga kerja jika tidak segera dimitigasi. Namun, di tengah awan mendung yang tengah menyelimuti Teluk Persia, Indonesia sebenarnya memegang kartu as geografis yang sering terlupakan, yaitu Alur Laut Kepulauan Indonesia ALKI. Jika Hormuz adalah urat nadi yang terputus, ALKIkhususnya ALKI II Selat Lombok hingga Selat Makassaradalah arteri cadangan yang bisa menjaga jantung ekonomi kita, atau mungkin dunia, tetap berdetak. Posisi strategis ALKI muncul sebagai antitesis krisis pascapenutupan Hormuz. Kapalkapal tanker dari wilayah yang tidak berkonflik seperti Australia atau Afrika Barat harus mencari jalur aman untuk menuju Asia Timur Tiongkok, Jepang, Korea Selatan. ALKI II Selat Lombok hingga Selat Makassar secara de facto menjadi jalur bypass paling aman dan jalur dalam deepwater route bagi kapalkapal tanker raksasa Very Large Crude Carriers menuju Asia Timur, yang mungkin tidak bisa melewati Selat Malaka karena semakin dangkal. Pakar maritim ITS, Prof. Raja Oloan Saut Gurning, menekankan bahwa optimalisasi ALKI II dapat menjadi katup pengaman distribusi energi regional. Dengan mengarahkan lalu lintas ke ALKI, Indonesia tidak hanya mengamankan pasokan energinya sendiri dari sumber alternatif, tetapi juga dapat memetik keuntungan dari jasa pemanduan dan logistik maritim internasional. Secara domestik, ALKI menjadi jalur distribusi vital untuk mengoptimalkan lifting minyak dan gas lokal dari wilayah Timur, seperti Blok Masela atau proyek IDD di Kalimantan menuju kilangkilang di Barat. Tanpa ketergantungan pada Hormuz, jalur ALKI memungkinkan Indonesia melakukan intraisland energy shift untuk meredam inflasi distribusi. Dengan solusi mitigasi, mengamankan jalur distribusi domestik untuk biofuel B35B40 dari Kalimantan dan Sulawesi, serta mengoptimalkan pengiriman minyak dalam negeri, pemerintah dapat menjaga stabilitas harga energi di tingkat lokal, meskipun jika ditanya Apakah stok kita cukup Jawabannya tentu belum. Namun, jika ditanya Apakah ALKI bisa menjadi jalur penyelamat agar ekonomi tidak mati total jawabannya tentu iya. ALKI memungkinkan kita mengamankan 40 pasokan minyak domestik dan 100 pasokan gas serta biofuel, yang cukup untuk menjaga sektorsektor vital militer, logistik pangan, dan listrik tetap berjalan. Keamanan jalur ALKI yang dijaga ketat oleh Tentara Nasional Indonesia Angkatan Laut TNI AL, memastikan bahwa meski dunia sedang berperang, aliran kebutuhan pokok antarpulau tidak terputus. Sebagaimana pernyataan Ekonom Universitas Andalas, Prof. Syafruddin Karimi, tekanan terhadap rupiah akan sangat bergantung pada seberapa cepat kita mengalihkan sumber energi ke jalurjalur yang kita kendalikan sendiri. Mantan Kepala Staf Angkatan Laut KSAL, Laksamana Marsetio, dalam bukunya Sea Power Indonesia, menekankan bahwa ALKI bukan sekadar hak lintas, melainkan juga alat diplomasi kedaulatan. Dalam kondisi krisis Hormuz, Indonesia memiliki daya tawar bargaining power geopolitik yang luar biasa. Dunia membutuhkan ALKI untuk selamat dari resesi energi. Indonesia dapat memposisikan diri sebagai Safe Keeper of Global Energy Supply. Dengan menjamin keamanan ALKI melalui patroli intensif TNI AL, Indonesia dapat menuntut kompensasi berupa investasi infrastruktur maritim dari negaranegara pengguna jalur tersebut seperti Tiongkok dan Jepang sekaligus memperkuat posisi tawar dalam negosiasi harga energi internasional. Krisis akibat penutupan Selat Hormuz di satu sisi menjadi lonceng kematian bagi sikap berpuas diri kita terhadap ketergantungan energi fosil impor. Indonesia tidak bisa terusmenerus menjadi sandera dari konflik geopolitik yang jaraknya ribuan kilometer. Diversifikasi energi ke sumber terbarukan dan penguatan cadangan penyangga energi nasional CPEN bukan lagi pilihan, melainkan keharusan untuk bertahan hidup. Pemberdayaan ALKI secara maksimal dapat menjawab soal ujian akibat krisis ini, sekaligus pembuktian Indonesia sebagai Poros Maritim Dunia. Pemerintah diharapkan mampu mengintegrasikan pengamanan ALKI dengan manajemen stok energi nasional secara taktis. Dengan begitu, kita tidak hanya akan selamat dari kiamat ekonomi global, tetapi juga mengukuhkan posisi Indonesia sebagai pemegang kunci stabilitas energi dunia. Hormuz mungkin terkunci, tetapi Nusantara melalui ALKInya kini terbuka sebagai jalan keluar bagi peradaban yang haus energi. Sudah saatnya kita berhenti melihat laut sebagai pemisah dan mulai mengelolanya sebagai arteri penyelamat kedaulatan bangsa serta dunia."
591,"Mengunci Nadi Dunia Selat Hormuz Tertutup, Dapatkah ALKI Menjadi Solusi",politik,"Andreas Halomoan Silalahi Andreas Halomoan Silalahi Activist  Founder Lembaga Kajian Indonesia Digdaya. Share a common interest in Geopolitics and Enviromental Issue. 2 Maret 2026 2030 WIBwaktu baca 5 menit Tulisan dari Andreas Halomoan Silalahi tidak mewakili pandangan dari redaksi kumparan Eskalasi militer Timur Tengah yang melibatkan Amerika Serikat AS, Israel, dan Iran beberapa waktu belakangan ini bukan lagi sekadar bumbu berita internasional. Dunia saat ini menyaksikan skenario paling menakutkan bagi stabilitas ekonomi global, yaitu penutupan Selat Hormuz. Sebagai jalur pelintasan bagi sekitar 21 juta barel minyak per hari yang setara dengan 21 konsumsi minyak dunia, Hormuz adalah jugular vein atau urat nadi pengalir energi global, yang jika terputus efeknya akan menyebabkan serangan jantung pada ekonomi globaltidak terkecuali Indonesia. Penutupan Selat Hormuz oleh Teheran adalah respons atas serangan gabungan brutal ASIsrael, yang telah menewaskan banyak tokohtokoh berpengaruh di Iran, termasuk Pemimpin Besar Republik Islam Iran, Ayatullah Al Khomeini. Harga minyak mentah jenis Brent melonjak melewati angka 100 per barel hanya dalam hitungan hari. Pakar energi UGM, Fahmy Radhi, memperingatkan bahwa jika konflik ini memanjang, angka 120 hingga 150 bukan lagi hal mustahil. Bagi Indonesia, ini adalah kabar buruk ganda. Sebagai negara net importer minyak, setiap kenaikan harga minyak dunia sebesar 1 per barel berpotensi membengkakkan beban subsidi dan kompensasi energi dalam APBN hingga Rp10,3 triliun CELIOS, 2026. Jika harga bertahan di atas 100, pemerintah akan dihadapkan pada pilihan pahit, yaitu menaikkan harga BBM domestik atau membiarkan defisit anggaran melebar melampaui batas aman 3. Dampak penutupan Hormuz juga merambat ke pasar valuta asing efek penutupan Hormuz terhadap pelemahan rupiah tidak terhindarkan karena kebutuhan dolar AS untuk impor energi meningkat drastis di tengah pelarian modal atau flight to quality ke aset aman seperti emas. Ekonom Universitas Andalas, Prof. Syafruddin Karimi, mencatat bahwa tekanan terhadap rupiah akan mempercepat imported inflation, yaitu inflasi yang disebabkan oleh mahalnya barang impor. Peran Hormuz tentu bukan hanya soal minyak. Jalur ini juga rute utama bagi pengiriman pupuk dan bahan baku petrokimia. Penutupan Hormuz tentu akan menghambat pasokan pupuk berbasis nitrogen dari Timur Tengah ke Asia. Indonesiayang tengah berjuang meningkatkan produktivitas pangandisinyalir akan mengalami kelangkaan pupuk yang tentunya akan berefek sebagai ancaman ketahanan pangan nasional. Ketua Umum Apindo, Shinta Kamdani, juga menekankan bahwa ekspor Indonesia ke kawasan Timur Tengah dan Eropa juga terancam mandek karena kapalkapal komersial dilarang mendekat ke area konflik. Hal ini menyebabkan gangguan rantai pasok terhadap sektor industri yang berorientasi ekspor dan dapat berefek terhadap pengurangan tenaga kerja jika tidak segera dimitigasi. Namun, di tengah awan mendung yang tengah menyelimuti Teluk Persia, Indonesia sebenarnya memegang kartu as geografis yang sering terlupakan, yaitu Alur Laut Kepulauan Indonesia ALKI. Jika Hormuz adalah urat nadi yang terputus, ALKIkhususnya ALKI II Selat Lombok hingga Selat Makassaradalah arteri cadangan yang bisa menjaga jantung ekonomi kita, atau mungkin dunia, tetap berdetak. Posisi strategis ALKI muncul sebagai antitesis krisis pascapenutupan Hormuz. Kapalkapal tanker dari wilayah yang tidak berkonflik seperti Australia atau Afrika Barat harus mencari jalur aman untuk menuju Asia Timur Tiongkok, Jepang, Korea Selatan. ALKI II Selat Lombok hingga Selat Makassar secara de facto menjadi jalur bypass paling aman dan jalur dalam deepwater route bagi kapalkapal tanker raksasa Very Large Crude Carriers menuju Asia Timur, yang mungkin tidak bisa melewati Selat Malaka karena semakin dangkal. Pakar maritim ITS, Prof. Raja Oloan Saut Gurning, menekankan bahwa optimalisasi ALKI II dapat menjadi katup pengaman distribusi energi regional. Dengan mengarahkan lalu lintas ke ALKI, Indonesia tidak hanya mengamankan pasokan energinya sendiri dari sumber alternatif, tetapi juga dapat memetik keuntungan dari jasa pemanduan dan logistik maritim internasional. Secara domestik, ALKI menjadi jalur distribusi vital untuk mengoptimalkan lifting minyak dan gas lokal dari wilayah Timur, seperti Blok Masela atau proyek IDD di Kalimantan menuju kilangkilang di Barat. Tanpa ketergantungan pada Hormuz, jalur ALKI memungkinkan Indonesia melakukan intraisland energy shift untuk meredam inflasi distribusi. Dengan solusi mitigasi, mengamankan jalur distribusi domestik untuk biofuel B35B40 dari Kalimantan dan Sulawesi, serta mengoptimalkan pengiriman minyak dalam negeri, pemerintah dapat menjaga stabilitas harga energi di tingkat lokal, meskipun jika ditanya Apakah stok kita cukup Jawabannya tentu belum. Namun, jika ditanya Apakah ALKI bisa menjadi jalur penyelamat agar ekonomi tidak mati total jawabannya tentu iya. ALKI memungkinkan kita mengamankan 40 pasokan minyak domestik dan 100 pasokan gas serta biofuel, yang cukup untuk menjaga sektorsektor vital militer, logistik pangan, dan listrik tetap berjalan. Keamanan jalur ALKI yang dijaga ketat oleh Tentara Nasional Indonesia Angkatan Laut TNI AL, memastikan bahwa meski dunia sedang berperang, aliran kebutuhan pokok antarpulau tidak terputus. Sebagaimana pernyataan Ekonom Universitas Andalas, Prof. Syafruddin Karimi, tekanan terhadap rupiah akan sangat bergantung pada seberapa cepat kita mengalihkan sumber energi ke jalurjalur yang kita kendalikan sendiri. Mantan Kepala Staf Angkatan Laut KSAL, Laksamana Marsetio, dalam bukunya Sea Power Indonesia, menekankan bahwa ALKI bukan sekadar hak lintas, melainkan juga alat diplomasi kedaulatan. Dalam kondisi krisis Hormuz, Indonesia memiliki daya tawar bargaining power geopolitik yang luar biasa. Dunia membutuhkan ALKI untuk selamat dari resesi energi. Indonesia dapat memposisikan diri sebagai Safe Keeper of Global Energy Supply. Dengan menjamin keamanan ALKI melalui patroli intensif TNI AL, Indonesia dapat menuntut kompensasi berupa investasi infrastruktur maritim dari negaranegara pengguna jalur tersebut seperti Tiongkok dan Jepang sekaligus memperkuat posisi tawar dalam negosiasi harga energi internasional. Krisis akibat penutupan Selat Hormuz di satu sisi menjadi lonceng kematian bagi sikap berpuas diri kita terhadap ketergantungan energi fosil impor. Indonesia tidak bisa terusmenerus menjadi sandera dari konflik geopolitik yang jaraknya ribuan kilometer. Diversifikasi energi ke sumber terbarukan dan penguatan cadangan penyangga energi nasional CPEN bukan lagi pilihan, melainkan keharusan untuk bertahan hidup. Pemberdayaan ALKI secara maksimal dapat menjawab soal ujian akibat krisis ini, sekaligus pembuktian Indonesia sebagai Poros Maritim Dunia. Pemerintah diharapkan mampu mengintegrasikan pengamanan ALKI dengan manajemen stok energi nasional secara taktis. Dengan begitu, kita tidak hanya akan selamat dari kiamat ekonomi global, tetapi juga mengukuhkan posisi Indonesia sebagai pemegang kunci stabilitas energi dunia. Hormuz mungkin terkunci, tetapi Nusantara melalui ALKInya kini terbuka sebagai jalan keluar bagi peradaban yang haus energi. Sudah saatnya kita berhenti melihat laut sebagai pemisah dan mulai mengelolanya sebagai arteri penyelamat kedaulatan bangsa serta dunia."
